### ISSUE TITLE
25 sec delay before response compared to NextCloud client

### ISSUE THREAD

**Issue by io-node** [Zimbra-Community/owncloud-zimlet#114]
When using the Zimlet I notice a 25 sec delay before NC is responding. Comparing this with the NC client (and also with command line Cadaver) which show no delay.

There is some difference between the request details between the Zimlet and Cadaver. I have attached both request packets (hidden the credentials)
[zimlet_pcap.txt](https://github.com/Zimbra-Community/owncloud-zimlet/files/732284/zimlet_pcap.txt)
[cadaver_pcap.txt](https://github.com/Zimbra-Community/owncloud-zimlet/files/732286/cadaver_pcap.txt)

**Comment by barrydegraaff** [comment]
What nextcloud/zimbra/zimlet version is that

**Comment by barrydegraaff** [comment]
Is there anything in the nextcloud log?

**Comment by io-node** [comment]
Sorry yes should provided more details:

NextCloud 11.0.1
Zimbra Zimbra 8.7.1_GA_1670 (build 20161025045105)
Zimlet 0.7.1

I can share more of the tcp trace, but will need to amend it bit to hide credentials.

**Comment by barrydegraaff** [comment]
Maybe you port number is not set correctly?

**Comment by barrydegraaff** [comment]
Transmission Control Protocol, Src Port: 35890 (35890), Dst Port: 8081 (8081), Seq: 1, Ack: 1, Len: 551

vs

      [Full request URI: http://<cloud-domain>:443/remote.php/webdav/Documents/]


why does that say 443?

**Comment by io-node** [comment]
There is a Apache proxy server in front. NextCloud runs on port 8081 on 192.168.7.245 while proxy is using 192.168.7.241 in private lan. There are other web-server running each with their own domains.

**Comment by barrydegraaff** [comment]
Is the proxy listening on the same port as nextcloud?

**Comment by io-node** [comment]
Proxy listens on port 443, then redirects traffic to 8081 on a different server.

**Comment by barrydegraaff** [comment]
Well, there may be something buggy there, also we did not test such scenarios.

If you want me to debug it for you, maybe you can consider getting a support subscription
https://www.powercraft.nl/zetalliance/

**Comment by squesson** [comment]
Hi, with:
NextCloud 11.0.2
Zimbra Release 8.6.0.GA.1153.UBUNTU14.64 UBUNTU14_64 FOSS edition, Patch 8.6.0_P6
Zimlet 0.7.5

network config is simple, no proxy. Zimlet is calling https://mynextcloud.fqdn:443/remote.php/webdav directly. I can see 30 seconds delay between calls and responses.
```
zimbra.ip - user [06/Mar/2017:23:13:58 +0100] "PROPFIND /remote.php/webdav/ HTTP/1.1" 207 5932 "-" "Sardine/UNAVAILABLE"
zimbra.ip - user [06/Mar/2017:23:14:36 +0100] "PROPFIND /remote.php/webdav/manual_v1.pdf HTTP/1.1" 207 639 "-" "Sardine/UNAVAILABLE"
zimbra.ip - user [06/Mar/2017:23:14:37 +0100] "GET /remote.php/webdav/manual_v1.pdf  HTTP/1.1" 200 151756 "-" "Sardine/UNAVAILABLE"
```

**Comment by io-node** [comment]
Most likely it is the brute force protection mechanism causing the 30 sec delay (at least it was in my case). 
You can check this by disabling the function and retry:

https://github.com/nextcloud/server/blob/c76dc835c4a1abc179bef3c469d837946fe4d339/config/config.sample.php#L210-L215

**Comment by squesson** [comment]
Thank you so much. You're probably right, since this morning access were fast!

**Comment by barrydegraaff** [comment]
@io-node thanks for providing the info, will add it to the readme.
